{
  "type": "feature",
  "feature_type": "ability",
  "name": "RAY OF AGONIZING SELF-REFLECTION",
  "flavor": "You inflict pain and doubt in equal measure.",
  "keywords": [
    "Magic",
    "Ranged",
    "Strike",
    "Void"
  ],
  "usage": "Main Action",
  "distance": "Ranged 10",
  "target": "One creature or object",
  "effects": [
    {
      "roll": "Power Roll + Reason",
      "t1": "2 + R corruption damage; R < weak, slowed (save ends)",
      "t2": "4 + R corruption damage; R < average, slowed (save ends)",
      "t3": "6 + R corruption damage; R < strong, slowed (save ends)"
    }
  ]
}