{
  "type": "feature",
  "feature_type": "trait",
  "name": "2nd-Level Exorcist Ability",
  "effects": [
    {
      "effect": "Choose one of the following abilities.",
      "features": [
        {
          "type": "feature",
          "feature_type": "ability",
          "name": "It Is Justice You Fear",
          "cost": "5 Wrath",
          "flavor": "I am but a vessel. Your own deeds weigh upon you.",
          "icon": "üèπ",
          "keywords": [
            "Magic",
            "Ranged",
            "Strike"
          ],
          "usage": "Main action",
          "distance": "Ranged 10",
          "target": "One creature",
          "effects": [
            {
              "roll": "Power Roll + Might",
              "tier1": "8 + M holy damage; P < WEAK, frightened (save ends)",
              "tier2": "12 + M holy damage; P < AVERAGE, frightened (save ends)",
              "tier3": "15 + M holy damage; P < STRONG, frightened (save ends)"
            },
            {
              "name": "Effect",
              "effect": "If the target is already frightened of you or another creature and this ability would frighten them again, they instead take psychic damage equal to twice your Presence score."
            }
          ]
        },
        {
          "type": "feature",
          "feature_type": "ability",
          "name": "Revelator",
          "cost": "5 Wrath",
          "flavor": "You channel holy energy to harm unbelievers and reveal those hidden from your judgment.",
          "icon": "‚ùáÔ∏è",
          "keywords": [
            "Area",
            "Magic"
          ],
          "usage": "Maneuver",
          "distance": "3 burst",
          "target": "Each enemy in the area",
          "effects": [
            {
              "name": "Effect",
              "effect": "Each target takes holy damage equal to twice your Presence score. Additionally, each hidden target is automatically revealed and can't become hidden again until the start of your next turn. You can then use your Judgment ability against one target as a free triggered action."
            }
          ]
        }
      ]
    }
  ]
}